{
  "$schema": "./release-manifest.schema.json",
  "schemaVersion": 1,
  "appVersion": "1.0.0",
  "backendProjectRef": "REPLACE_ME_PROJECT_REF",
  "controlledOrigin": "https://REPLACE_ME.invalid",
  "paymentsLive": false,
  "legalContacts": {
    "support": "support@REPLACE_ME.invalid",
    "legal": "legal@REPLACE_ME.invalid",
    "safety": "safety@REPLACE_ME.invalid",
    "privacy": "privacy@REPLACE_ME.invalid",
    "dmca": "dmca@REPLACE_ME.invalid"
  },
  "policyVersions": {
    "terms": "2026-07-05",
    "privacy": "REPLACE_ME_PRIVACY_VERSION",
    "guidelines": "REPLACE_ME_GUIDELINES_VERSION"
  },
  "smokeReceipt": {
    "timestamp": "REPLACE_ME_ISO_TIMESTAMP",
    "checklist": {
      "cloudConnection": false,
      "readerFeed": false,
      "subscriptionPurchase": false,
      "subscriptionRestore": false,
      "supportCheckout": false,
      "paymentWebhook": false,
      "supportHistory": false,
      "journalistPayoutStatus": false
    }
  },
  "deployAttestation": {
    "attestedBy": "REPLACE_ME_OPERATOR",
    "attestedAt": "REPLACE_ME_ISO_TIMESTAMP",
    "workerSecrets": {
      "nciiWorker": false,
      "supportWorker": false,
      "paymentsWebhook": false,
      "accountWorker": false
    }
  }
}
